{
  "schema_version": 1,
  "date": "2026-07-06",
  "scope": "slmp-ethernet-port",
  "description": "Canonical PLC model and Ethernet-unit profile definitions for the SLMP library family. Generated from evidence/profile-definitions.",
  "policy": {
    "default_strict": true,
    "state_semantics": {
      "supported": "Adopted as supported for this profile. Send normally.",
      "blocked": "Not adopted for this profile. In strict mode, fail before transport.",
      "config-dependent": "Depends on the PLC configuration, such as whether the target unit exists. Do not guard; send and let the PLC respond.",
      "unverified": "Unverified. In strict mode, guard as blocked; with strict disabled, allow sending.",
      "delegated": "Delegated to existing runtime mechanisms, such as SD-derived device range lookup and global rules. The profile does not decide or guard this feature."
    }
  },
  "evidence_files": {
    "melsec:iq-r": "evidence/profile-definitions/iq-r_profile_definition.md",
    "melsec:iq-r:rj71en71": "evidence/profile-definitions/iq-r_rj71en71_profile_definition.md",
    "melsec:iq-l": "evidence/profile-definitions/iq-l_profile_definition.md",
    "melsec:mx-r": "evidence/profile-definitions/mx-r_profile_definition.md",
    "melsec:mx-f": "evidence/profile-definitions/mx-f_profile_definition.md",
    "melsec:iq-f": "evidence/profile-definitions/iq-f_profile_definition.md",
    "melsec:qcpu": "evidence/profile-definitions/qcpu_profile_definition.md",
    "melsec:qcpu:qj71e71-100": "evidence/profile-definitions/qcpu_qj71e71-100_profile_definition.md",
    "melsec:lcpu": "evidence/profile-definitions/lcpu_profile_definition.md",
    "melsec:lcpu:lj71e71-100": "evidence/profile-definitions/lcpu_lj71e71-100_profile_definition.md",
    "melsec:qnu": "evidence/profile-definitions/qnu_profile_definition.md",
    "melsec:qnu:qj71e71-100": "evidence/profile-definitions/qnu_qj71e71-100_profile_definition.md",
    "melsec:qnudv": "evidence/profile-definitions/qnudv_profile_definition.md",
    "melsec:qnudv:qj71e71-100": "evidence/profile-definitions/qnudv_qj71e71-100_profile_definition.md"
  },
  "profiles": {
    "melsec:iq-r": {
      "frame": "4E",
      "compat": "iQ-R",
      "subcommands": {
        "word": "0002",
        "bit": "0003",
        "ext_word": "0082",
        "ext_bit": "0083"
      },
      "verified_models": [
        "R120PCPU(built-in Ethernet)",
        "R120PCPU via RJ71EN71"
      ],
      "features": {
        "type_name": {
          "state": "supported",
          "source": "live"
        },
        "direct": {
          "state": "supported",
          "source": "live"
        },
        "random": {
          "state": "supported",
          "source": "live"
        },
        "block": {
          "state": "supported",
          "source": "live"
        },
        "monitor": {
          "state": "supported",
          "source": "live"
        },
        "ext_module_access": {
          "state": "config-dependent",
          "source": "live"
        },
        "ext_link_direct": {
          "state": "config-dependent",
          "source": "live"
        },
        "hg_cpu_buffer": {
          "state": "supported",
          "source": "live"
        },
        "long_device_path": {
          "state": "supported",
          "source": "live"
        },
        "lz_32bit_path": {
          "state": "supported",
          "source": "live"
        }
      },
      "limits": {
        "direct_word_read": {
          "source": "live",
          "max": 960,
          "over_end_code": "C051"
        },
        "direct_word_write": {
          "source": "live",
          "max": 960,
          "over_end_code": "C051"
        },
        "direct_bit_read": {
          "source": "live",
          "max": 7168,
          "over_end_code": "C052"
        },
        "direct_bit_write": {
          "source": "live",
          "max": 7168,
          "over_end_code": "C052"
        },
        "random_read_word": {
          "source": "live",
          "max": 96,
          "over_end_code": "C054"
        },
        "random_write_word": {
          "source": "live",
          "max": 80,
          "weighted_max": 960,
          "over_end_code": "C054"
        },
        "random_write_bit": {
          "source": "live",
          "max": 94,
          "over_end_code": "C053"
        },
        "monitor_register_word": {
          "source": "live",
          "max": 96,
          "over_end_code": "C054"
        },
        "random_read_word_ext": {
          "source": "live",
          "max": 96,
          "over_end_code": "C054"
        },
        "random_write_word_ext": {
          "source": "live",
          "max": 80,
          "weighted_max": 960,
          "over_end_code": "C054"
        },
        "random_write_bit_ext": {
          "source": "live",
          "max": 94,
          "over_end_code": "C053"
        },
        "monitor_register_word_ext": {
          "source": "live",
          "max": 96,
          "over_end_code": "C054"
        }
      },
      "write_policy": {
        "S": "read-only"
      },
      "scope": "builtin-ethernet-port",
      "display_name": "MELSEC iQ-R (built-in)"
    },
    "melsec:iq-r:rj71en71": {
      "frame": "4E",
      "compat": "iQ-R",
      "subcommands": {
        "word": "0002",
        "bit": "0003",
        "ext_word": "0082",
        "ext_bit": "0083"
      },
      "verified_models": [
        "R120PCPU via RJ71EN71"
      ],
      "features": {
        "type_name": {
          "state": "supported",
          "source": "policy"
        },
        "direct": {
          "state": "supported",
          "source": "policy"
        },
        "random": {
          "state": "supported",
          "source": "policy"
        },
        "block": {
          "state": "supported",
          "source": "policy"
        },
        "monitor": {
          "state": "supported",
          "source": "policy"
        },
        "ext_module_access": {
          "state": "config-dependent",
          "source": "policy"
        },
        "ext_link_direct": {
          "state": "config-dependent",
          "source": "policy"
        },
        "hg_cpu_buffer": {
          "state": "supported",
          "source": "policy"
        },
        "long_device_path": {
          "state": "supported",
          "source": "policy"
        },
        "lz_32bit_path": {
          "state": "supported",
          "source": "policy"
        }
      },
      "limits": {
        "direct_word_read": {
          "source": "inferred",
          "max": 960,
          "over_end_code": "C051"
        },
        "direct_word_write": {
          "source": "inferred",
          "max": 960,
          "over_end_code": "C051"
        },
        "direct_bit_read": {
          "source": "inferred",
          "max": 7168,
          "over_end_code": "C052"
        },
        "direct_bit_write": {
          "source": "inferred",
          "max": 7168,
          "over_end_code": "C052"
        },
        "random_read_word": {
          "source": "inferred",
          "max": 96,
          "over_end_code": "C054"
        },
        "random_write_word": {
          "source": "inferred",
          "max": 80,
          "weighted_max": 960,
          "over_end_code": "C054"
        },
        "random_write_bit": {
          "source": "inferred",
          "max": 94,
          "over_end_code": "C053"
        },
        "monitor_register_word": {
          "source": "inferred",
          "max": 96,
          "over_end_code": "C054"
        },
        "random_read_word_ext": {
          "source": "inferred",
          "max": 96,
          "over_end_code": "C054"
        },
        "random_write_word_ext": {
          "source": "inferred",
          "max": 80,
          "weighted_max": 960,
          "over_end_code": "C054"
        },
        "random_write_bit_ext": {
          "source": "inferred",
          "max": 94,
          "over_end_code": "C053"
        },
        "monitor_register_word_ext": {
          "source": "inferred",
          "max": 96,
          "over_end_code": "C054"
        }
      },
      "write_policy": {
        "S": "read-only"
      },
      "scope": "ethernet-unit",
      "display_name": "MELSEC iQ-R (RJ71EN71)",
      "base_profile": "melsec:iq-r"
    },
    "melsec:iq-l": {
      "frame": "4E",
      "compat": "iQ-R",
      "subcommands": {
        "word": "0002",
        "bit": "0003",
        "ext_word": "0082",
        "ext_bit": "0083"
      },
      "verified_models": [
        "L16HCPU(built-in Ethernet)"
      ],
      "features": {
        "type_name": {
          "state": "supported",
          "source": "live"
        },
        "direct": {
          "state": "supported",
          "source": "live"
        },
        "random": {
          "state": "supported",
          "source": "live"
        },
        "block": {
          "state": "supported",
          "source": "live"
        },
        "monitor": {
          "state": "supported",
          "source": "live"
        },
        "ext_module_access": {
          "state": "config-dependent",
          "source": "live"
        },
        "ext_link_direct": {
          "state": "config-dependent",
          "source": "live"
        },
        "hg_cpu_buffer": {
          "state": "blocked",
          "source": "spec"
        },
        "long_device_path": {
          "state": "supported",
          "source": "live"
        },
        "lz_32bit_path": {
          "state": "supported",
          "source": "live"
        }
      },
      "limits": {
        "direct_word_read": {
          "source": "live",
          "max": 960,
          "over_end_code": "C051"
        },
        "direct_word_write": {
          "source": "live",
          "max": 960,
          "over_end_code": "C051"
        },
        "direct_bit_read": {
          "source": "live",
          "max": 7168,
          "over_end_code": "C052"
        },